{
  "allowlist": [
    {
      "path": "docker-compose.yml",
      "reason": "The documented development-only database password for the disposable local PostgreSQL container. It is not a production credential, no deployment reads it, and the exception is this one file and this one rule - a pattern covering the directory would also cover a production DSN committed beside it.",
      "rule_id": "SEC-004-PASSWORD-ASSIGNMENT"
    }
  ],
  "allowlist_count": 1,
  "allowlist_policy": "Each entry names one exact path and one exact rule with a reason. There is no directory-wide exclusion and no blanket skip of tests or fixtures, because an excluded directory is one where a real secret can later be committed unnoticed.",
  "classified_finding_count": 31,
  "classified_findings": [
    {
      "classification": "NEGATIVE_FIXTURE",
      "line": 33,
      "matched_length": 26,
      "path": "tests/fixtures/wp23/negative_controls.py",
      "rule_id": "SEC-001-PRIVATE-KEY",
      "severity": "CRITICAL"
    },
    {
      "classification": "NEGATIVE_FIXTURE",
      "line": 36,
      "matched_length": 30,
      "path": "tests/fixtures/wp23/negative_controls.py",
      "rule_id": "SEC-001-PRIVATE-KEY",
      "severity": "CRITICAL"
    },
    {
      "classification": "NEGATIVE_FIXTURE",
      "line": 44,
      "matched_length": 24,
      "path": "tests/fixtures/wp23/negative_controls.py",
      "rule_id": "SEC-003-BEARER-LITERAL",
      "severity": "HIGH"
    },
    {
      "classification": "NEGATIVE_FIXTURE",
      "line": 45,
      "matched_length": 28,
      "path": "tests/fixtures/wp23/negative_controls.py",
      "rule_id": "SEC-003-BEARER-LITERAL",
      "severity": "HIGH"
    },
    {
      "classification": "NEGATIVE_FIXTURE",
      "line": 48,
      "matched_length": 38,
      "path": "tests/fixtures/wp23/negative_controls.py",
      "rule_id": "SEC-004-PASSWORD-ASSIGNMENT",
      "severity": "HIGH"
    },
    {
      "classification": "NEGATIVE_FIXTURE",
      "line": 49,
      "matched_length": 41,
      "path": "tests/fixtures/wp23/negative_controls.py",
      "rule_id": "SEC-004-PASSWORD-ASSIGNMENT",
      "severity": "HIGH"
    },
    {
      "classification": "NEGATIVE_FIXTURE",
      "line": 52,
      "matched_length": 46,
      "path": "tests/fixtures/wp23/negative_controls.py",
      "rule_id": "SEC-005-DSN-CREDENTIAL",
      "severity": "CRITICAL"
    },
    {
      "classification": "NEGATIVE_FIXTURE",
      "line": 53,
      "matched_length": 35,
      "path": "tests/fixtures/wp23/negative_controls.py",
      "rule_id": "SEC-005-DSN-CREDENTIAL",
      "severity": "CRITICAL"
    },
    {
      "classification": "NEGATIVE_FIXTURE",
      "line": 119,
      "matched_length": 47,
      "path": "tests/unit/api/test_contracts.py",
      "rule_id": "SEC-004-PASSWORD-ASSIGNMENT",
      "severity": "HIGH"
    },
    {
      "classification": "NEGATIVE_FIXTURE",
      "line": 150,
      "matched_length": 48,
      "path": "tests/unit/api/test_errors.py",
      "rule_id": "SEC-004-PASSWORD-ASSIGNMENT",
      "severity": "HIGH"
    },
    {
      "classification": "NEGATIVE_FIXTURE",
      "line": 242,
      "matched_length": 34,
      "path": "tests/unit/api/test_errors.py",
      "rule_id": "SEC-004-PASSWORD-ASSIGNMENT",
      "severity": "HIGH"
    },
    {
      "classification": "NEGATIVE_FIXTURE",
      "line": 198,
      "matched_length": 56,
      "path": "tests/unit/api/test_health.py",
      "rule_id": "SEC-004-PASSWORD-ASSIGNMENT",
      "severity": "HIGH"
    },
    {
      "classification": "NEGATIVE_FIXTURE",
      "line": 198,
      "matched_length": 25,
      "path": "tests/unit/api/test_health.py",
      "rule_id": "SEC-005-DSN-CREDENTIAL",
      "severity": "CRITICAL"
    },
    {
      "classification": "NEGATIVE_FIXTURE",
      "line": 288,
      "matched_length": 23,
      "path": "tests/unit/api/test_runtime_verification.py",
      "rule_id": "SEC-003-BEARER-LITERAL",
      "severity": "HIGH"
    },
    {
      "classification": "NEGATIVE_FIXTURE",
      "line": 201,
      "matched_length": 47,
      "path": "tests/unit/api/test_safety.py",
      "rule_id": "SEC-004-PASSWORD-ASSIGNMENT",
      "severity": "HIGH"
    },
    {
      "classification": "NEGATIVE_FIXTURE",
      "line": 38,
      "matched_length": 26,
      "path": "tests/unit/application/test_release_cli.py",
      "rule_id": "SEC-004-PASSWORD-ASSIGNMENT",
      "severity": "HIGH"
    },
    {
      "classification": "NEGATIVE_FIXTURE",
      "line": 44,
      "matched_length": 28,
      "path": "tests/unit/infrastructure/test_configuration_policy.py",
      "rule_id": "SEC-004-PASSWORD-ASSIGNMENT",
      "severity": "HIGH"
    },
    {
      "classification": "NEGATIVE_FIXTURE",
      "line": 103,
      "matched_length": 26,
      "path": "tests/unit/infrastructure/test_configuration_policy.py",
      "rule_id": "SEC-005-DSN-CREDENTIAL",
      "severity": "CRITICAL"
    },
    {
      "classification": "NEGATIVE_FIXTURE",
      "line": 241,
      "matched_length": 37,
      "path": "tests/unit/infrastructure/test_configuration_policy.py",
      "rule_id": "SEC-005-DSN-CREDENTIAL",
      "severity": "CRITICAL"
    },
    {
      "classification": "NEGATIVE_FIXTURE",
      "line": 326,
      "matched_length": 18,
      "path": "tests/unit/infrastructure/test_configuration_policy.py",
      "rule_id": "SEC-005-DSN-CREDENTIAL",
      "severity": "CRITICAL"
    },
    {
      "classification": "NEGATIVE_FIXTURE",
      "line": 333,
      "matched_length": 18,
      "path": "tests/unit/infrastructure/test_configuration_policy.py",
      "rule_id": "SEC-005-DSN-CREDENTIAL",
      "severity": "CRITICAL"
    },
    {
      "classification": "NEGATIVE_FIXTURE",
      "line": 348,
      "matched_length": 18,
      "path": "tests/unit/infrastructure/test_configuration_policy.py",
      "rule_id": "SEC-005-DSN-CREDENTIAL",
      "severity": "CRITICAL"
    },
    {
      "classification": "NEGATIVE_FIXTURE",
      "line": 406,
      "matched_length": 26,
      "path": "tests/unit/infrastructure/test_configuration_policy.py",
      "rule_id": "SEC-005-DSN-CREDENTIAL",
      "severity": "CRITICAL"
    },
    {
      "classification": "NEGATIVE_FIXTURE",
      "line": 571,
      "matched_length": 34,
      "path": "tests/unit/infrastructure/test_seed_and_cleanup_safety.py",
      "rule_id": "SEC-005-DSN-CREDENTIAL",
      "severity": "CRITICAL"
    },
    {
      "classification": "NEGATIVE_FIXTURE",
      "line": 583,
      "matched_length": 34,
      "path": "tests/unit/infrastructure/test_seed_and_cleanup_safety.py",
      "rule_id": "SEC-005-DSN-CREDENTIAL",
      "severity": "CRITICAL"
    },
    {
      "classification": "NEGATIVE_FIXTURE",
      "line": 589,
      "matched_length": 34,
      "path": "tests/unit/infrastructure/test_seed_and_cleanup_safety.py",
      "rule_id": "SEC-005-DSN-CREDENTIAL",
      "severity": "CRITICAL"
    },
    {
      "classification": "NEGATIVE_FIXTURE",
      "line": 44,
      "matched_length": 28,
      "path": "tests/unit/ingestion/test_ingestion_cli.py",
      "rule_id": "SEC-004-PASSWORD-ASSIGNMENT",
      "severity": "HIGH"
    },
    {
      "classification": "NEGATIVE_FIXTURE",
      "line": 45,
      "matched_length": 32,
      "path": "tests/unit/ingestion/test_request_key_and_cache.py",
      "rule_id": "SEC-004-PASSWORD-ASSIGNMENT",
      "severity": "HIGH"
    },
    {
      "classification": "NEGATIVE_FIXTURE",
      "line": 219,
      "matched_length": 32,
      "path": "tests/unit/validation/test_cases.py",
      "rule_id": "SEC-004-PASSWORD-ASSIGNMENT",
      "severity": "HIGH"
    },
    {
      "classification": "NEGATIVE_FIXTURE",
      "line": 112,
      "matched_length": 26,
      "path": "tests/unit/verification/test_scrub.py",
      "rule_id": "SEC-001-PRIVATE-KEY",
      "severity": "CRITICAL"
    },
    {
      "classification": "NEGATIVE_FIXTURE",
      "line": 254,
      "matched_length": 47,
      "path": "tests/unit/web/test_security.py",
      "rule_id": "SEC-004-PASSWORD-ASSIGNMENT",
      "severity": "HIGH"
    }
  ],
  "finding_count": 0,
  "findings": [],
  "negative_fixture_count": 14,
  "negative_fixtures": [
    {
      "path": "tests/fixtures/wp23/negative_controls.py",
      "reason": "WP-23's own negative controls. Each string exists to prove one rule fires; a rule with no fixture proving it detects anything is a rule nobody has run."
    },
    {
      "path": "tests/unit/verification/test_scrub.py",
      "reason": "WP-19's scrubber tests. The private-key header here is the input that proves the scrubber removes one."
    },
    {
      "path": "tests/unit/api/test_runtime_verification.py",
      "reason": "Proves an Authorization header is stripped from runtime evidence before it is written."
    },
    {
      "path": "tests/unit/infrastructure/test_configuration_policy.py",
      "reason": "WP-02's configuration-policy tests. The password literal is the input that proves configuration values are redacted."
    },
    {
      "path": "tests/unit/api/test_contracts.py",
      "reason": "Proves a prohibited request field's value never reaches a response body."
    },
    {
      "path": "tests/unit/api/test_errors.py",
      "reason": "Proves an error body never quotes a submitted value."
    },
    {
      "path": "tests/unit/api/test_health.py",
      "reason": "Proves the readiness document never quotes a DSN."
    },
    {
      "path": "tests/unit/api/test_safety.py",
      "reason": "Proves a prohibited value never reaches an assessment response."
    },
    {
      "path": "tests/unit/web/test_security.py",
      "reason": "Proves a rendered page never carries a credential."
    },
    {
      "path": "tests/unit/application/test_release_cli.py",
      "reason": "Proves the release CLI redacts a DSN in its output."
    },
    {
      "path": "tests/unit/ingestion/test_ingestion_cli.py",